{
  "$schema": "https://json-schema.org/draft/2020-12/schema",
  "title": "acord_25",
  "type": "object",
  "properties": {
    "form_info": {
      "type": "object",
      "properties": {
        "form_number": {
          "type": [
            "string",
            "null"
          ]
        },
        "form_edition": {
          "type": [
            "string",
            "null"
          ]
        },
        "form_title": {
          "type": [
            "string",
            "null"
          ]
        }
      },
      "required": [
        "form_number",
        "form_edition",
        "form_title"
      ],
      "additionalProperties": false
    },
    "header": {
      "type": "object",
      "properties": {
        "insured_name": {
          "type": [
            "string",
            "null"
          ]
        },
        "insured_address": {
          "type": [
            "string",
            "null"
          ]
        },
        "insured_city": {
          "type": [
            "string",
            "null"
          ]
        },
        "insured_state": {
          "type": [
            "string",
            "null"
          ],
          "enum": [
            "AL",
            "AK",
            "AZ",
            "AR",
            "CA",
            "CO",
            "CT",
            "DE",
            "FL",
            "GA",
            "HI",
            "ID",
            "IL",
            "IN",
            "IA",
            "KS",
            "KY",
            "LA",
            "ME",
            "MD",
            "MA",
            "MI",
            "MN",
            "MS",
            "MO",
            "MT",
            "NE",
            "NV",
            "NH",
            "NJ",
            "NM",
            "NY",
            "NC",
            "ND",
            "OH",
            "OK",
            "OR",
            "PA",
            "RI",
            "SC",
            "SD",
            "TN",
            "TX",
            "UT",
            "VT",
            "VA",
            "WA",
            "WV",
            "WI",
            "WY",
            "DC",
            "PR",
            "GU",
            "VI",
            "AS",
            "MP",
            null
          ]
        },
        "insured_zip": {
          "type": [
            "string",
            "null"
          ]
        },
        "carrier_name": {
          "type": [
            "string",
            "null"
          ]
        },
        "policy_number": {
          "type": [
            "string",
            "null"
          ]
        },
        "effective_date": {
          "type": [
            "string",
            "null"
          ]
        },
        "expiration_date": {
          "type": [
            "string",
            "null"
          ]
        },
        "producer_name": {
          "type": [
            "string",
            "null"
          ]
        },
        "producer_code": {
          "type": [
            "string",
            "null"
          ]
        }
      },
      "required": [
        "insured_name",
        "insured_address",
        "insured_city",
        "insured_state",
        "insured_zip",
        "carrier_name",
        "policy_number",
        "effective_date",
        "expiration_date",
        "producer_name",
        "producer_code"
      ],
      "additionalProperties": false
    },
    "document_date": {
      "type": [
        "string",
        "null"
      ]
    },
    "certificate_holders": {
      "type": "array",
      "items": {
        "type": "object",
        "properties": {
          "name": {
            "type": [
              "string",
              "null"
            ]
          },
          "address": {
            "type": [
              "string",
              "null"
            ]
          }
        },
        "required": [
          "name",
          "address"
        ],
        "additionalProperties": false
      }
    },
    "carrier_name_per_lob": {
      "type": "array",
      "items": {
        "type": "object",
        "properties": {
          "lob": {
            "type": [
              "string",
              "null"
            ]
          },
          "carrier": {
            "type": [
              "string",
              "null"
            ]
          },
          "naic": {
            "type": [
              "string",
              "null"
            ]
          },
          "policy_number": {
            "type": [
              "string",
              "null"
            ]
          }
        },
        "required": [
          "lob",
          "carrier",
          "naic",
          "policy_number"
        ],
        "additionalProperties": false
      }
    },
    "coverages_certified": {
      "type": "array",
      "items": {
        "type": "object",
        "properties": {
          "coverage_type": {
            "type": [
              "string",
              "null"
            ]
          },
          "policy_number": {
            "type": [
              "string",
              "null"
            ]
          },
          "effective_date": {
            "type": [
              "string",
              "null"
            ]
          },
          "expiration_date": {
            "type": [
              "string",
              "null"
            ]
          },
          "limit": {
            "type": [
              "string",
              "null"
            ]
          }
        },
        "required": [
          "coverage_type",
          "policy_number",
          "effective_date",
          "expiration_date",
          "limit"
        ],
        "additionalProperties": false
      }
    },
    "checkboxes": {
      "type": "array",
      "items": {
        "type": "object",
        "properties": {
          "field": {
            "type": "string"
          },
          "value": {
            "type": "string",
            "enum": [
              "Yes",
              "No"
            ]
          }
        },
        "required": [
          "field",
          "value"
        ],
        "additionalProperties": false
      }
    },
    "remarks": {
      "type": [
        "string",
        "null"
      ]
    }
  },
  "required": [
    "form_info",
    "header",
    "document_date",
    "certificate_holders",
    "carrier_name_per_lob",
    "coverages_certified",
    "checkboxes",
    "remarks"
  ],
  "additionalProperties": false
}
