{
  "carrier_name_per_lob": [],
  "certificate_holders": [
    {
      "address": "5290 Walnut Street, Ste. 159, Newport News, VA 23601",
      "name": "Navigator Realty Management Inc."
    }
  ],
  "checkboxes": [
    {
      "field": "Commercial General Liability - Claims Made",
      "value": "No"
    },
    {
      "field": "Commercial General Liability - Occur",
      "value": "No"
    },
    {
      "field": "Commercial General Liability - General Aggregate Limit Applies Per Policy",
      "value": "No"
    },
    {
      "field": "Commercial General Liability - General Aggregate Limit Applies Per Project",
      "value": "No"
    },
    {
      "field": "Commercial General Liability - General Aggregate Limit Applies Per Location",
      "value": "No"
    },
    {
      "field": "Commercial General Liability - General Aggregate Limit Applies Per Other",
      "value": "No"
    },
    {
      "field": "Automobile Liability - Any Auto",
      "value": "No"
    },
    {
      "field": "Automobile Liability - Owned Autos Only",
      "value": "No"
    },
    {
      "field": "Automobile Liability - Scheduled Autos",
      "value": "No"
    },
    {
      "field": "Automobile Liability - Hired Autos Only",
      "value": "No"
    },
    {
      "field": "Automobile Liability - Non-Owned Autos Only",
      "value": "No"
    },
    {
      "field": "Umbrella Liability - Occur",
      "value": "No"
    },
    {
      "field": "Umbrella Liability - Claims Made",
      "value": "No"
    },
    {
      "field": "Umbrella Liability - Deductible",
      "value": "No"
    },
    {
      "field": "Workers Compensation - Per Statute",
      "value": "No"
    },
    {
      "field": "Workers Compensation - Other",
      "value": "No"
    }
  ],
  "coverages_certified": [],
  "document_date": "2026-03-15",
  "form_info": {
    "form_edition": "2016/03",
    "form_number": "ACORD 25",
    "form_title": "CERTIFICATE OF LIABILITY INSURANCE"
  },
  "header": {
    "carrier_name": null,
    "effective_date": null,
    "expiration_date": null,
    "insured_address": "250 Civic Center Drive, Suite 600",
    "insured_city": "Columbus",
    "insured_name": "Buckeye Industrial Properties, LLC",
    "insured_state": "OH",
    "insured_zip": "43215",
    "policy_number": null,
    "producer_code": null,
    "producer_name": "Midwest Property & Casualty Group"
  },
  "remarks": "RE: Industrial real estate investment and management \u2014 warehouse, distribution, and light manufacturing facilities throughout Ohio. Locations: Rickenbacker Logistics Center - A - 6500 Alum Creek Drive, Columbus, OH 43217; Rickenbacker Logistics Center - B - 6600 Alum Creek Drive, Columbus, OH 43217; Cleveland Distribution Hub - 4800 Tiedeman Road, Brooklyn, OH 44144. Navigator Realty Management Inc. is included as Additional Insured as required by written contract. 30 days notice of cancellation will be provided."
}