{
  "form_info": {
    "form_number": "ACORD 25",
    "form_edition": null,
    "form_title": "CERTIFICATE OF LIABILITY INSURANCE"
  },
  "header": {
    "insured_name": "Keystone Commercial Builders, Inc.",
    "insured_address": "300 Liberty Avenue, Suite 1200",
    "insured_city": "Pittsburgh",
    "insured_state": "PA",
    "insured_zip": "15222",
    "carrier_name": "Hallmark Insurance Group",
    "policy_number": null,
    "effective_date": "2025-08-01",
    "expiration_date": "2026-08-01",
    "producer_name": "Steel City Insurance Group",
    "producer_code": null
  },
  "document_date": "2026-03-16",
  "certificate_holders": [
    {
      "name": "Woodbridge Realty Management Inc.",
      "address": "4715 Maple Avenue, Unit 129, Birmingham, AL 35201"
    }
  ],
  "carrier_name_per_lob": [
    {
      "lob": "Commercial General Liability",
      "carrier": "Hallmark Insurance Group",
      "naic": "41883",
      "policy_number": "GL-KCB-2025-5581"
    },
    {
      "lob": "Automobile Liability",
      "carrier": "Hallmark Insurance Group",
      "naic": "41845",
      "policy_number": "CA-KCB-2025-5582"
    },
    {
      "lob": "Workers Compensation",
      "carrier": "Hallmark Insurance Group",
      "naic": "41837",
      "policy_number": "WC-KCB-2025-5580"
    }
  ],
  "coverages_certified": [
    {
      "coverage_type": "Commercial General Liability",
      "policy_number": "GL-KCB-2025-5581",
      "effective_date": "2025-08-01",
      "expiration_date": "2026-08-01",
      "limit": "2000000"
    },
    {
      "coverage_type": "Automobile Liability",
      "policy_number": "CA-KCB-2025-5582",
      "effective_date": "2025-08-01",
      "expiration_date": "2026-08-01",
      "limit": "5000000"
    },
    {
      "coverage_type": "Workers Compensation",
      "policy_number": "WC-KCB-2025-5580",
      "effective_date": "2025-08-01",
      "expiration_date": "2026-08-01",
      "limit": "1000000"
    }
  ],
  "checkboxes": [
    {
      "field": "Commercial General Liability - Claims-Made",
      "value": "No"
    },
    {
      "field": "Commercial General Liability - Occur",
      "value": "Yes"
    },
    {
      "field": "Commercial General Liability - Gen'l Aggregate Limit Applies Per Policy",
      "value": "Yes"
    },
    {
      "field": "Commercial General Liability - Gen'l Aggregate Limit Applies Per Project",
      "value": "No"
    },
    {
      "field": "Commercial General Liability - Gen'l Aggregate Limit Applies Per Loc",
      "value": "No"
    },
    {
      "field": "Automobile Liability - Any Auto",
      "value": "Yes"
    },
    {
      "field": "Automobile Liability - Owned Autos Only",
      "value": "No"
    },
    {
      "field": "Automobile Liability - Scheduled Autos",
      "value": "No"
    },
    {
      "field": "Automobile Liability - Hired Autos Only",
      "value": "No"
    },
    {
      "field": "Automobile Liability - Non-Owned Autos Only",
      "value": "No"
    },
    {
      "field": "Workers Compensation - WC Statutory Limits",
      "value": "Yes"
    },
    {
      "field": "Workers Compensation - Other",
      "value": "No"
    }
  ],
  "remarks": "RE: General contracting for commercial and institutional construction - healthcare facilities, educational buildings, and corporate offices throughout Western Pennsylvania locations. Corporate Headquarters - 300 Liberty Avenue, Suite 1200, Pittsburgh, PA 15222; Main Equipment Yard & Warehouse - 4500 Butler Street, Pittsburgh, PA 15201; Fabrication Shop - 4520 Butler Street, Pittsburgh, PA 15201. Woodbridge Realty Management Inc. is included as Additional Insured as required by written contract. 30 days notice of cancellation will be provided."
}