{
  "form_info": {
    "form_number": "ACORD 25",
    "form_edition": "2016/03",
    "form_title": "CERTIFICATE OF LIABILITY INSURANCE"
  },
  "header": {
    "insured_name": "Buckeye Industrial Properties, LLC",
    "insured_address": "250 Civic Center Drive, Suite 600",
    "insured_city": "Columbus",
    "insured_state": "OH",
    "insured_zip": "43215",
    "carrier_name": null,
    "policy_number": null,
    "effective_date": null,
    "expiration_date": null,
    "producer_name": "Midwest Property & Casualty Group",
    "producer_code": null
  },
  "document_date": "2026-03-15",
  "certificate_holders": [
    {
      "name": "Navigator Realty Management Inc.",
      "address": "5290 Walnut Street, Ste. 159, Newport News, VA 23601"
    }
  ],
  "carrier_name_per_lob": [],
  "coverages_certified": [],
  "checkboxes": [],
  "remarks": "RE: Industrial real estate investment and management - warehouse, distribution, and light manufacturing facilities throughout Ohio. Locations: Rickenbacker Logistics Center - A - 6500 Alum Creek Drive, Columbus, OH 43217; Rickenbacker Logistics Center - B - 6600 Alum Creek Drive, Columbus, OH 43217; Cleveland Distribution Hub - 4800 Tiedeman Road, Brooklyn, OH 44144. Navigator Realty Management Inc. is included as Additional Insured as required by written contract. 30 days notice of cancellation will be provided."
}